paragraphs,reference_summary
" Satanginipun saking kantaka Arjuna botên nêdya umangsah malih, ananging enggal mundur lajêng mêndhêt lêmpung kadamêl rêcanipun Hyang Mahadewa, sasampunipun dados, lajêng sinungkêman ngarsanipun, tuwin kinalungan sêkar rinonce. Nanging uncèn-uncèn sêkar wau lajêng musna, katingal kumalung ing lungayanipun Kerata. Sang Arjuna anggarjita jroning wardaya: baya iki Bathara Mahadewa, mila enggal sumungkêm ing pada, sarwi minta aksama, dene ngantos kamipurun lumawan prang, kabêkta saking kirang waspada. Hyang Mahadewa kabadharan, lajêng paring nugraha dhatêng Arjuna, punapadene Hyang Mahadewa andhawuhakên kaluhuraning pribadinipun. Satêlasing pangandikanipun Hyang Mahadewa, Arjuna winêjang mantra manawi anandukakên pasopati, dhawuhipun Hyang Siwah dhatêng Arjuna: nadyan para têtungguling dewa botên wontên ingkang wuninga dhatêng pangwasa punika. Pasopati lajêng anyêlaki Arjuna, kados nalika Sangkara antuk ganjaran dêdamêling dewa. Sasampunipun matêdhakakên gandhewa Hyang Siwah tumuntên botên katingalan.;","Arjuna nampi sih-rahmat saking Hyang Mahadewa, ngantos saged ngadhepi musuh kanthi kekuatan anyar."
"Salêbêtipun Arjuna taksih anjêngêr kasaru rawuhipun Bathara Indra, Bathara Waruna, Bathara Kuwera, tuwin Bathara Yama, kaayap dening para dewa nayaka saandhahanipun. Bathara Yama matêdhakakên gadanipun, Bathara Waruna maringakên palu rante, Bathara Kuwera paring dêdamêl ingkang anêngsêmakên, inggih punika manawi kalêpasakên, mêngsahipun lajêng tilêm, dene Sang Hyang Indra angganjar rata titihanipun, saha dhawuh supados lajêng tinumpakan kangge minggah dhatêng kaswargan. Sarêng para dewa sampun botên katingalan, rata tumurun, Arjuna sêsuci lajêng mêmuji ing dewa, wontên pucaking Indrakila. Saparipurnaning anggènipun manêmbah, Arjuna aminggah ing rata cahya, rata mêsat anggayuh gêgana. Ing nalika wau Arjuna aningali alam ingkang sumorot, manawi katandhing kalihan kawontênan ing dunya kadi pajaring kartika. Arjuna botên kasamaran, bilih punika Sanarawati kithanipun Sang Hyang Indra. Arjuna lumêbêt ing kitha wau, kapapakakên dening para dewa lajêng angurung-urung lampahipun Arjuna. Sarêng dumugi sangajênging singangsananipun Sang Hyang Indra, Arjuna enggal anyungkêmi padanipun. Arjuna katarik dhatêng dhampar sakiwanipun  Sang Hyang Indra, kaparingan palu galudhug tuwin balêdhèg, agêmipun Sang Hyang Indra, sarta kadhawahan lêrêm wontên ing swarga, tuwin puruhita dhatêng Citrasena, narendraning gandarwa, juru lêlagon tuwin gêndhing ing kaswargan, pikajêngipun kawruh bab cacah, swara, tuwin laras .;","Para dewa maringi hadiah dhatêng Arjuna, lan ngidini Arjuna ndeleng swarga, nampi anugerah saking Hyang Indra."
"Nadyan Arjuna miturut sarta têtêp dhatêng kawajiban ingkang sinangkulakên, salêbêtipun puruhita wontên ing kaswargan ngantos gangsal warsa, ananging panggalihipun anggung kaèngêtan dhatêng para kadang ingkang wontên ing dunya, anggènipun andalajah sawawêngkoning wana, dununging anggenipun kakendhangakên. Sadèrèngipun kaparêng wangsul, Arjuna dinadar, punapa manahipun ugi sukci kados badanipun. Dèwi Uruwasi, têtungguling widadari, ingkang kadi sasăngka purnama, kautus ngrancana dhatêng Arjuna. Kacariyos sarêng Arjuna priksa dhatêng Dèwi Uruwasi sigra lumajêng amarêpêki, sadumugining ngarsanipun lajêng sumungkêm ing kisma kadi anggènipun angurmati dhatêng lêluhur ingkang anurunakên bangsanipun. Utawi kadidene pangaji-ajining anak jalêr dhatêng biyungipun, pangaji-aji langkung saking samantên sampun botên wontên malih.;","Arjuna tansah eling dhatêng tugasipun sanajan wonten ing swarga, déné Dèwi Uruwasi nyoba nggodha Arjuna nanging boten kasil."
"  Nanging Dèwi Uruwasi sangêt botên rêna, punapa darunanipun dene manungsa punika sêsrawunganipun botên rumakêt. Arjuna kesah, cariyos dhatêng Citrasena punapa ingkang mêntas kalampahan, Citrasena lajêng matur ing Sang Hyang Indra, Sang Hyang Indra nugrahani dhatêng Arjuna: kagawa saka sabaran  miwah bisane mangrèh marang pribadine, kongsi kaya rêsi. Sotipun Hyang Indra wau kababaripun lajêng dados nugraha, amargi sarêng dumugi tigawêlas taunipun anggèning kabucal, Arjuna botên kasumêrêpan bilih satriya, mila rahayu. Ing nalika wau Hyang Indra amatah Maharsi Lomasa, kautus dhatêng marcapada manggihi para Pandhawa, paring pawartos karaharjanipun Arjuna, sarta andhawuhakên supados para Pandhawa anjajah saliring panggenan kang sukci-sukci. Sadèrèngipun Arjuna wangsul dhatêng marcapada, badhe anyirnakakên asura langkung rumiyin, sabibaring prang sawêg nêdya wangsul nunggil kalayan para kadang. Maharsi Lomasa mangkat kautus manggihi Yudhisthira dalah para ari. ;","Hyang Indra maringi ganjaran dhatêng Arjuna amargi kesabaranipun, nglantaraken Arjuna bali dhatêng donya, lan Maharsi Lomasa maringi pawartos dhatêng Pandhawa."
"Tiyang sagêd angintên-intên piyambak, kados punapa lêganing manahipun para Pandhawa mirêng pawartos, bilih sadhèrèkipun ingkang sangêt dipun trêsnani punika sagêd anglêksanani sapiwêlingipun, mila kalayan sakalangkung inggaring panggalih, Yudhisthira lajêng pangkat nêdya andalajah sagung pasukcian  anglêksanani dhawuhipun Sang Hyang Indra, kairit dening Maharsi Lomasa  sasampunipun dangu anggènipun lêlana, wêkasan dumugi ing wêwêngkoning Imalaya, parêdèn   ing Kelasa, tilas pratapanipun Sang Nara kalihan Narayana. Pandhawa lêrêmipun wontên ing ngriku ngantos sawatawis dangu, kalayan sênêng tuwin têntrêming panggalihipun.;","Pandhawa nglêksanani dhawuhipun Sang Hyang Indra, ngantos dumugi Ing Imalaya lan lêrêm sawetawis dangu ing Kelasa."
"Ing satunggaling dintên wontên prahara agêng, sasirêping prahara maèwu-èwu sêkar tunjung ingkang kadi sinêbar ing sakiwa têngêning palêrêmanipun. Saking sêngsêmipun dhatêng endah saha aruming gandanipun, Dèwi Drupadi lajêng mangatag dhatêng Bima supados kapêndhêtna panunggilanipun sêkar wau. Bima pangkat ngalèr ngetan minggah ing rêdi, samargi-margi tansah abăndayuda kalayan kewan galak, ananging sadaya kasoran dening Bima, mila lêstantun lampahipun anjog ing wana tarataban. Ing ngriku katingal wontên margi alit, mila lajêng dipun purugi. Anoman ugi putranipun Bathara Bayu kados Sang Bima, saking anggènipun badhe ngatingalakên lêlabêtan dhatêng kadangipun, angèngêtakên: kasasar aja liwat ing kono, marga dalan iku ora kêna liniwatan ing wong kang isih kêna ing pati. Bima anyêlaki, kados padatanipun mirantos badhe lumawan prang, sarta manguwuh sora supados tangiya dhatêng kêthèk ingkang katingalipun tilêm punika. Anoman ngêlèkakên netranipun sêmu taksih sangêt arip, sarwi anggrêsah dene kasar têmên anggènipun anggugah, ing ngriku lajêng sanjang dhatêng satriya nèm-nèman wau, manawi margi ingkang dipun langkungi punika, marginining para dewa, mila amung para ambangun tapa ingkang kenging langkung ing ngriku.;","Pradara punika agêng, Bima anglêksanani, ananging Anoman ngêlèkakên ngantos salamet ngingalên margi."
" Bima pitakèn sintên ta naminipun, sarta mratelakakên nami tuwin bangsanipun piyambak kalayan sêmu ladak, wangsulanipun Anoman: ingsun iki kêthèk: sêmu tumambuh, tuwin angèngêtakên, manawi badhe wilujêng prayogi tumuntên wangsula. Kalihan wêngis kêdalipun Bima mangatag supados sumingkir, nanging Anoman mangsuli manawi badanipun sakit kangge ngadêg, Bima kêncêng badhe nglajêngakên lampahipun, mila Anoman ingkang rewa-rewa sakit badhe sumungkir, lajêng sanjang supados kalajêngna lampahipun, nanging murih sampun ngantos ngidak buntutipun, prayogi manawi buntutipun kasingkirna. Bima lajêng anyandhak buntuting wanara kalayan astanipun kiwa, ing sêmu karèmèhakên, nanging sarêng badhe kajunjung Bima botên kuwawi. Lajêng kacêpêng tangan kalih, ewadene ebah kemawon botên, Bima angêtog karosanipun, ngantos karingêtipun daleweran, buntuting wanara mêksa botên kangkat, Bima lajêng linggih sangajênging wanara ingkang linangkung wau, kalihan angapurancang, angrêrêpa pitakèn, piyambakipun wau sintên, mangsuli manawi nama Anoman, senapatining  wanara, ingkang sampun mêmitran kalayan Sang Rama, satunggaling awatara.;","Bima pitakên nama Anoman, lan manawi sampun luwih, Anoman punika senapati wanara."
" Ing nalika wau sadhèrèk kêkalih punika sih- sinihan sarta Anoman anêdahakên margi ingkang kêdah dipun langkungi dening Bima, sarta lajêng musna. Bima anglajêngakên lampahipun, ngantos kapêntok ing lèpèn, wêkasan dumugi ing talaga ingkang sakalangkung kathah tunjungipun. Ananging sarêng Bima badhe amêthik sêkar, wontên sagêlênganing raksasa ingkang anyêlaki sarwi cariyos, manawi talaga punika kagunganipun Bathara Kuwera, mila botên kenging tiyang mêthik sêkar bilih botên saking palilahipun, Bima botên kadugi nêdha dhatêng salah satunggaling manungsa, punapadene Bima lajêng nêdya nyêmplung dhatêng ing talaga wau. Para ingkang rumêksa narajang dhatêng Bima, tinadhahan ngantos maatus-atus raksasa ingkang pêjah dening gadanipun Wrêkudara, sisaning pêjah sami lumajêng nyuwun pitulunganipun Bathara Kuwera. Nanging Bathara Kuwera gumujêng sarta Bima pinarêngakên angundhuh sadaya bilih saking panêdhanipun Dèwi Krêsna.; ","Bima anggêbèkaken alitipun Bima, ananging saking margi kaanggep prasaja."
"Sawangsulipun Bima, Yudhisthira tuwin ari kêkalih, punapadene Dèwi Krêsna lajêng kagendhong dening Gathutkaca, inggih raksasa putranipun Bima, napak jumantara kabêkta dhatêng sukuning rêdi Gadamadana, ing ngriku sakalangkung anêngsêmakên, mila lajêng sami nêdya lêrêm ing ngriku ngantos wangsulipun Arjuna. Nanging sarêng sampun angsal sawatawis dintên, dhawuhing dewa sadaya kêdah wangsul dhatêng pratapanipun Rêsi Nara kalihan Narayana, sasampunipun kêdah dhatêng pratapan kêkalih. Sadaya miturut, mêdal ing margi ingkang sampun katêdahakên, samargi-margi ugi kathah sangêt lêlampahan ingkang dipun lampahi, wêkasan dumugi ing rêdi Mèru, dêdunung ing ngriku ngantos sadhatêngipun Arjuna. Ing satunggaling dintên, nêdhêngipun para Pandhawa sami wiraosan bab kawontênanipun Arjuna, katingal wontên rata agêng titihanipun Sang Hyang Indra tumurun saking awiyat, katumpakan dening Arjuna sarwi angendhong jêmparing sarta amangku gandhewa pêparinging dewa. Sarêng sampun cêlak Arjuna mancolot, lajêng manêmbah dhatêng Dumeya, Yudhisthira tuwin Bima. Kados punapa sami bingah ing panggalihipun sarêng apêpanggihan, dados pêpisahanipun wau sampun kapêngkêr, sarta gêgayuhan anggènipun sami lêlanabrata punika sampun kasêmbadan .;",Sang Hyang Indra ingkang anindakên margi lan sintên niku sami dipun paringi dhèwèning Arjuna.
"Cundhukipun wontên ing ngriku para Pandhawa ngantos kawan taun, sadèrèngipun wontên ing ngriku, sampun nêm taun, dados anggènipun kakendhangakên sampun angsal sadasa taun,  lêlana malih urut parêdèn ngantos sataun kalayan rumaos sakalangkung mulya, ngantos dumugi têpining Saraswati, kèndêl ing ngriku ngantos sawatawis dangu.;",Pandhawa padha lampah kanthi sawatara ngantos dhatêng Saraswati.
"Karantên sampun têlas wêwangên anggènipun kakendhangakên amila para Pandhawa lajêng nêdya wangsul dhatêng wana Kamyaka. Sadhatêngipun ing Kamyaka, Sri Krêsna amapakakên, saking anggènipun badhe anyobi panggalihipun Yudhisthira, Sri Krêsna lajêng mrayogèkakên supados Yudhisthira amêpak wadyabala sagêgamaning prang. Dene ingkang minăngka senapatinipun Sang Balarama, kadangipun sêpuh Sri Krêsna, lumurug dhatêng Astina. Ananging Yudhisthira puguh, wangsulanipun: sasampunipun kalampahan kalihwêlas taun wontên ing wana, kêdah anamur warna ngantos sataun, sasampunipun punika nyuwun pitulunganipun Sri Krêsna. Manawi botên nyuwun pitulunganipun Sri Krêsna, sintên malih ingkang dipun suwuni pitulungan. Sutaning Pandhu botên purun nyimpang saking margining kasêtyan, awit para Pritaputra saking kasaenan tuwin sukcinipun, punapadene sawadyabala saha kulawarganipun, sami ngakêni bilih amung Sri Krêsna pangayomanipun.;",Krêsna ngajêngaken Pandhawa ngajêng mugi dadi kabêktèn.
"Nêdhêng ramenipun anggèning sami wiraosan, kasaru rawuhipun  Maharsi Markandheya, para Pandhawa punapadene Sri Krêsna sami angurmati, saha lajêng angancarani lênggah. Sasampunipun tata lênggah, Sri Krêsna matur ing sang maharêsi, kaparênga amêdharakên tataning watak utami, tumrap para narendra, para pawèstri tuwin para pandhita.  ing ngriku sang maharsi amêdharakên pitêdah warni-warni, nanging ingkang kula pêthik ing mriki amung saprakawis.;",Pandhawa dhatêng Sri Krêsna ngajêng nglêksanani pitakèn lan dhêdhêsan.
"Yudhisthira mitêrangakên, wêwatakan kados punapa, ingkang prayogi dipun lampahi. Dhawuh wangsulanipun: anindakna kautamèn dhatêng sagunging dumados, sarta tansah mangangkaha prayoginipun sadaya wau. Ingkang sih dhatêng sagung tumitah, tuwin sampun anangsaya dhatêng sadaya wau. Sampun ngantos kirang pangatos-atos manawi ngandika, ingkang nalăngsa, ingkang santosa pamasesanipun dhatêng ardaning panggalih, punapadene sampun kêndhat anggènipun paring pangayoman dhatêng tiyang sanagari. Ngangkaha kautamèn, tuwin ambirata saliring dosa, sarta ingkang bêkti dhatêng lêluhur saha para dewa, sampun ngantos tumindak ingkang botên kanthi kawêwekan, sarta anglêbura dosa sarana angêgungakên wêlas asih. Kalisa dening ambêg adigung, ingkang andhap asor, sadaya wau wêwatakan  ingkang prayogi ing atasipun panjênêngan nata. Manawi sawarnining kadunyan anangsaya, mugi ingkang santosa, manawi makatên yêkti kamulyan ingkang ginadhangakên paduka. Makatên kawontênanipun watak sae ingkang kawursita wontên ing sêrat piwulang luhur.; ",Yudhisthira ngêwrataken dhawuh agêng ring panggalih.
"Tumrap para pandhita kados ing ngandhap punika: pandhita kêdah amusthi dêdamêl têtiga, sêmanggêm mêpêt pangandika, akudhung mêrang kaanam, gundhul, anyandhang klikaning kajêng utawi lulanging kewan. Têtêp dhatêng sêsanggêman, badanipun sukci, kurban latu, manggèn wontên ing wana, saras badanipun, ewadene sadaya wau sampun tanpa guna, manawi botên sukci manahipun, luhuring budi, sampun ngantos anglampahi dosa ing dalêm tindak, manah tuwin cipta, makatên wau sajatining pandhita ingkang dêrêng kasutapanipun. Dados sanès tiyang ingkang anangsaya badan, sarana angêblêng  tuwin sapanunggilanipun malih. Tiyang ingkang kirang rumêsêp dhatêng kadang warganipun, punika botên sagêd kalis dening dosa, sanadyan badanipun sampun sukci, sintên ingkang manahipun wangkal têtela mêngsahing kasutapan, nadyan atapa brata, punika botên nama anyingkur kamulyan ing dunya.; ",Pandhita kêdah anglêksanani pangandika kanthi budi luhur.
"Sintên ingkang tansah sukci, saha kêbak dening kautamèn, nadyan sujanma wau angêgungakên katrêsnan, inggih punika sajatining muni. Malah ngantosa tiyang wau taksih nunggil kalihan kulawarganipun, botên sagêd kalepetan dosa. Pasa tuwin subrata sanèsipun malih, punika botên dados panglêburing dosa, nadyan kados punapa anggènipun anglêlêsu anggaringakên badanipun, amargi punika amung daging tuwin rah kemawon. Sintêna tiyangipun, ingkang botên rahayu budi, amung nyênyakit sarira, sarana cêcêgah, punika lampah pamuta tuli. Angurang-ngurangi iku, sanadyan apa bae kang kinarêpake, yèn sarana sarupaning laku kang mangkono mau ora dadi jalaraning uwal saka dosa.;","Sing suci lan kebak kautamèn ora kalebu dosa, sanajan sujanma nampa katresnan. Pasa lan subrata ora dadi dosa, amarga mung badan lan daging."
"Sing sapa kang angsung pangan wong kaluwèn, lan sapa bae kang angadêgake omah, kanggo pamondhokaning sadhengah wong kang têka, iku ginantungan ganjaran marga saka sêsajine mau Kadospundi dene jêjaka Hindhu ngupaya puruhitan dhatêng agami sanès, sêrat-sêrat sukcinipun piyambak sampun angêwrat dêdongengan pintên-pintên ingkang amarah prakawis kautamèn.;","Sapa kang angsung pangan lan ngadegake omah, bakal entuk ganjaran kanggo sêsaji kasebut."
" Kunêng ingkang sami wiraosan saha dêdongengan, kados ta cariyos lêlampahanipun Brahmana Kusika anggènipun amulang dhatêng juru ngupaya paksi kang ambêg utami . Gêntos ingkang winiraos, Prabu Sangkuni kalihan Karna tansah angojok-ojoki, supados Duryudana martuwi dhatêng para Pandhawa, wigatos amung ngangkah Pandhawa nyumêrêpana kamulyanipun Duryudana, ngantos èngêt dhatêng sangsaraning kawontênanipun, amrih lajêng kuwur manahipun. Saking anggènipun nêdya anilapakên sang prabu Drêtarastra, Karna mrayogèkakên, supados Duryudana pamit kang rama, badhe sêsaji dhatêng wana Dwita tilas padununganipun para Pandhawa. Ananging Prabu Drêtarastra ugi mirêng manawi padununganipun para Pandhawa botên têbih saking ngriku, mila lajêng dhawuh supados Duryudana utusan kemawon, sampun ngantos lumampah piyambak, Sangkuni sumambung ing atur, manawi badhe botên anyêlaki padununganipun para Pandhawa, pratela api-api prasêtya botên nêdya pinanggih kalihan para sutanipun Pandhu. Mila Prabu Drêtarastra paring palilah. Duryudana lajêng bidhal, kadhèrèkakên wadyabala agêng sangkêp sagêgamaning ajurit.; ",Kisah Brahmana Kusika ingkang ngupaya paksi minangka conto dhatêng agami. Sangkuni lan Karna ngarahake Duryudana nglawan Pandhawa.
"Samargi-margi para Kurawa tansah mangun suka, ingkang warni-warni sarananipun, sarta nacahakên wadyabalanipun, ngantos dumugi sacêlaking  talaga sukci ing Dwita wana, padununganipun para Pandhawa. Ing nalika pacalanging lampah wiwit lumêbêt ing wana, sakubênging talaga sukci wau rinêksa dening para gandarwa, margi botên kenging kaambah, awit ratuning gandarwa sampun rawuh saking anggènipun lêlana, mila wana kadhawuhan rumêksa sampun ngantos kalêbêtan tiyang mănca. Ananging Duryudana mêksa badhe anglajêngakên lampahipun, mila lajêng dados prang agêng. Para Kurawa kathah ingkang katiwasan, malah Karna ingkang kasantosanipun kadi sela karang, dangu-dangu mêksa kapalajêng. Dene Duryudana amargi botên purun oncat lajêng katawan, punapadene Dusasana sarta sanèsipun malih lajêng sami kawarăngka. Wadyabalanipun Kurawa ingkang kapalajêng wau sami ngungsi dhatêng Pandhawa, supados dipun ayomi. Sugal wangsulanipun Bima, malah angundhat-undhat, sarta pratela manawi botên purun amitulungi. Ananging Yudhisthira lajêng dhawuh: iki dudu mangsane angêcapake wicara wêngis, sarta lajêng ngandika, sanadyan kadange iku mungsuhe garêjêgan, nanging iya kudu angluhurake wajibing kêkadangan, yèn kadange mau kamungsuh dening wong liya.; ","Para Kurawa ngupaya perang ing Dwita wana, nanging Duryudana dipengaruhi Sangkuni lan Karna kanggo tetep melu perang."
"Yudhisthira dhawuh supados para ari sami sawega dêdamêl, sarta lajêng pangkat angrêbat Duryudana sakadangipun ingkang sami kawarăngka. Para gandarwa botên purun angluwari boyonganipun, mila Pandhawa lajêng narajang ing para gandarwa, têmah sami pêpêrangan ngantos ratunipun angêdali kapapagakên dening Arjuna, prang rukêt ulêng-ulêngan, nanging Citrasena lajêng angèngêtakên pamitranipun, Arjuna pitakèn, punapa sababipun têka prang kalihan Duryudana. Citrasena pratela anggènipun marăngka Duryudana punika amargi kalampahanipun dhatêng ing ngriku wau, prêlu badhe mangerang-erang dhatêng sangsaraning Pandhawa. Sakawitipun Citrasena botên nayogyani manawi boyonganipun kaaturakên Yudhisthira, nanging sarêng sampun nyariyosakên asoring cidranipun Duryudana dhatêng Pandhawa, Citrasena lajêng anglilahakên, amargi Pandhawa amung sumendhe ing pêpasthèn. Ing nalika wau Yudhisthira tansah angasih-asih supados gandarwaraja tumuntên angluwarana dhatêng Duryudana, sasampunipun Duryudana sakadangipun linuwaran, Yudhisthira pêpèngêt dhatêng Duryudana kalayan mangarah-arah: o kakangmas, sampun anindaki pandamêl ingkang botên prayogi malih. Amargi sintêna ingkang botên prayogi pandamêlipun, punika botên sagêd manggih kabêgjan, dhuh turasing băngsa Kuru, mugi lêstantuna nugraha sakadang warga, manawi kaparêng ing panggalih suwawi lajêng wangsula dhatêng praja, paduka botên dadak manggih sangsara nglampahi dados boyongan. Narendra kang sadu budi wau kalampahanipun pêpèngêt makatên, amung saking angèngêti, manawi Duryudana punika anunggil rah kalihan sariranipun, sarta dhumawah ing kasangsaran margi saking kalintunipun.;","Yudhisthira ngarahake supaya ngleksanakake kabijakan kang leres, sanajan mungsuh kang ora purun patuh."
"Duryudana kesah kalayan nawung prihatos, sapisan dene kawon anggènipun prang, kaping kalihipun angèngêti anggènipun dipun luwari. Nalika Duryudana lênggah amargi sampun tanpa karêkat, saking sangêting rudatos, Karna anyêlaki kalintu pangintênipun, Duryudana kamanah manggih unggul, mila mangalêmbana dhatêng kalangkunganipun Duryudana, dene sagêd angawonakên gandarwaraja, ingkang Karna piyambak ngantos kapêksa anguncati. Măngka sayêktosipun Duryudana kawon, milanipun Duryudana lajêng nyariyosakên kawontênaning kasusahan, pratela bilih sêdyanipun punika sampun kasumêrêpan, tuwin Yudhisthira ngluwari sariranipun, dados sariranipun wau kapotangan gêsang dening mêngsahipun, ingkang kinuya-kuya. Gêsang makatên rumaos botên kadugi anglampahi, mila pangangkahipun badhe anganyut tuwuh sarana luwe, tuwin mrayogèkakên  Dusasana lajêng gumantos kalênggahanipun.;","Duryudana nyoba perang, nanging para gandarwa ora purun nulung. Arjuna lan Citrasena ngatur strategi nglawan Duryudana."
"Dusasana anyungkêmi sampeyanipun ingkang raka, sarwi karuna sarta prasêtya bilih botên nêdya gumantos kaprabon, punapadene mangarih-arih supados kang raka anyandèkna karsanipun makatên wau, lêstantuna ngasta pusaraning praja, minăngka pangayomaning para kadang warga. Karna matur malih sarta mratelakakên manawi para Pandhawa botên badhe damêl punapa-punapa kajawi amung anglampahi sadhawuhing ratunipun, punapadene Sangkuni mrayogèkakên supados Duryudana rukuna kalihan Pandhawa. Saha kaparingana pusakaning tiyang sêpuhipun minăngka ganjaran. Ananging Duryudana kêkah nêdya anglampus dhiri, lênggah ing sanginggiling rumput kusa, amawas pribadinipun, angèsthi kamuksan. Gêlênganing para danawa tuwin ditya priksa bilih sirnanipun Duryudana punika badhe anyuda karosanipun, anggèning mêmêngsahan kalihan para dewa. Mila sarana kasaktènipun ngatingali dhatêng narendra ingkang sangêt prihatos wau, sarta lajêng amambêngi karsanipun, ngaturakên kados punapa kalintunipun manawi ngantos anglampus dhiri. ;","Yudhisthira ngelingake Duryudana supaya ora nglanggar kewajiban, nanging Duryudana terus melu perang."
"Para danawa tuwin ditya sagah damêl unggulipun Duryudana anggènipun mêmêngsahan kalihan Pandhawa, sarta prasêtya badhe ambiyantu misungsung wadya  danawa sinêkti pintên-pintên ingkang badhe kalairakên dhatêng ing dunya pêparingipun mahiswara dhatêng piyambakipun, amêca manawi Sang Karna sagêd anyirnakakên Arjuna, dados Duryudana lajêng mangrèh bawana tanpa tanding. Pratela manawi piyambakipun punika prajuriting Asura, dene Pandhawa minăngka prajuriting dewa. Sarêng midangêt kasagahanipun para danawa tuwin ditya, Duryudana lajêng nyandèkakên anggènipun anganyut tuwuh, tuwin katêtangi kasudiranipun, enggal jumênêng anjangkêpakên dêdamêlipun, kondur dhatêng Astinapura.;","Duryudana krasa kasulitan nalika perang, amarga kahanan sing angel."
"Sawangsulipun saking wana, Karna lajêng lêlana andon yuda, anêlukakên pintên-pintên nagari, supados sami nungkul dhatêng Duryudana, sarta amargi saking anggènipun nêdya adamêl pamiwahaning sêsaji, inggih punika sêsaji dhatêng Wisrawa, murih lajêng sinêbut têtungguling para narendra. Ing batos nêdya adamêl rajasuya. Nanging tamtu botên kalampahan sadangunipun Yudhistira taksih gêsang. Anggènipun Karna badhe adamêl bingahipun Duryudana, lajêng prasêtya badhe acêgah daging, botên wisuh, ugi tamtu anyukakakên punapa ingkang katêdha ing tiyang, supados sagêd kalampahan anyirnakakên Arjuna.; ","Karna ngupaya nulungi Duryudana lan ngatur strategi, nanging kasuksesan ora bisa dicapai amarga pengaruh dewa."
"Prasêtyanipun Karna wau awon kadadosanipun, amargi Sang Hyang Indra nêdya amitulungi Arjuna, lajêng manggihi Karna, minta kotang kadewatan, tuwin antingipun Karna. Karna nêdya anêtêpi prasêtyanipun, dados kaecalan pirantosipun ingkang dados panulaking sadaya dêdamêl .;","Karna tumindak miturut prasêtyan, nanging amargi dewa, kahanan berubah lan nguntungake Arjuna."
