paragraphs,reference_summary
"Senapati Sang Drona, ingkang ratanipun apangirit kuda janjam jêne, tandangipun adamêl miris, nêdya amikut  Yudhisthira. Pundi ingkang angalang-alangi kasirnakakên, kalampahan sagêd ajêng-ajêngan kalihan Yudhisthira. Sarêng Kurawa andugi manawi Yudhisthira kacêpêng, surak mawurahan kadi manêngkêr wiyati. Ananging Arjuna ingkang ratanipun kinusiran dening Kesawa, atêtulung ayuda, suwantêning rodha gumalêgêr kadi galudhug, pabarisan Kurawa mawut asarsaran dening pangamukipun Arjuna, nanging lajêng kasaput sêraping surya.; ","Drona arep nglawan Yudhisthira, Arjuna mbantu nglawan Kurawa."
"Ing sontên wau wontên satriya nênêm sami sadhèrèk, prajanji kalihan Prabu Susarman, ratuning băngsa Trigata, sami prasêtya badhe prang tandhing kalihan Arjuna ngantos sirna salah satunggal. Sarêng sampun rampung pangrêmbagipun, Arjuna katantang, amargi Arjuna tinangsulan dening prasêtyanipun bilih botên badhe mundur sabên katantang, mila lajêng pamit kang raka. Kalilan pangkat, amung Sêtyajit supados katilar anjagi sariranipun. Arjuna kadhawuhan pangkat mapagakên wadyanipun Samstaka ingkang sampun prasêtya kalayan para sadhèrèkipun badhe amapagakên Arjuna ngantos sirna salah satunggal, mila lajêng sami bidhal dhatêng panggenan ingkang sampun katamtokakên. Salêbêtipun Arjuna kinêmbulan dening mêngsahipun, Drona nêmpuh barisipun Yudhisthira, lajêng prang rame ulêng-ulêngan wor suh mungsuh lawan  rowang, dangu-dangu wadya ingkang ngurung-urung Yudhisthira pêdhot gandhenganipun, Yudhisthira angoncati gurunipun, ing ngriku Bima têtulung ing ayuda. Sanadyan kadospunapa anggènipun angêtog kêkiyatanipun, ananging mêksa botên kawawa anadhahi barisan dipangga ingkang angrisak manungsa, turăngga, tuwin rata, wêkasan wadya Pandhawa mundur. Arjuna ingkang kinalang-kalang dening mêngsah, panggalihipun kados kabêlah kalih, pundi ingkang kêdah kasirnakakên rumiyin, wasana golong kêdah amêjahi ingkang manantang wau, mila lajêng angantêp prangipun. Sarêng sampun sirna enggal wangsul nêmpuh barisanipun Drona. Arjuna kapapag dipangga ingkang tinitihan dening Bagadata, lajêng campuh prang, nanging rata ingkang kinusiran Kesawa katalèyèk dening sandêring dipangga. Bagadata nêdya ngrumiyini Arjuna anggènipun nêdya nêmpuh panganjuring baris. Bagadata mênthang langkapipun anglêpasi Arjuna, nanging Kesawa lajêng mancolot dhatêng ngajênging mitranipun, jêmparing kenging pranajanipun Krêsna lajêng anggubêt kadi uncèn-uncèn sêkar. Arjuna kagèt lajêng matur dhatêng Sri Krêsna sêmu botên rêna, bilih Krêsna sabên-sabên makatên, punika atêgês nyênyamah.;",Arjuna lan para prajurit padha tandhing nglawan Drona.
" Sri Krêsna mangsuli kalayan mèsêm, manawi dêdamêl punika pusakaning  băngsa Wrêsni, cabaripun amung kalihan sariranipun, amargi punika dêdamêlipun Narayana. Ing nguni jêmparing punika tumurunipun dhatêng marcapada, kaganjarakên dhatêng putranipun, wêkasan tumurun dhatêng Bagadata. Salêbêtipun Bagadata anggadhuh jêmparing punika, Bagadata botên sagêd kasoran, samangke jêmparing sampun wontên ing astanipun Krêsna, dados Arjuna sampun sagêd anyirnakakên Bagadata dalasan dipangga titihanipun. Sarêng sampun wanci sontên, inggih punika wasananipun dintên paprangan ingkang kaping kalih wêlas, Pandhawa unggul anggènipun prang, dene Drona dèrèng sagêd anêtêpi sêsanggêmanipun anggènipun sagah mikut Sang Yudhisthira.; ","Sri Krêṣṇa maringi jêmparing marang Bagadata, ngasilaké Pandhawa unggul ing perang."
"Dintênipun ingkang kaping tiga wêlas wangsulipun Bathara Warsas dhatêng kaswargan, dèwa wau ingkang manjanma dados Sang Abimanyu putranipun Arjuna, ingkang mijil saking Sumbadra kadangipun Sri Krêsna. Prajurit linangkung wau, dintên punika misuwur kasudiranipun, dene sawêg yuswa nêmbêlas taun sampun kadugi angêdali prang agêng tandhing kalayan para senapati agung-agung, sarta pundi ingkang tinêmpuh sami dhadhal datan mănggapulih. Arjuna katantang prang misah saking barisan agêng malih. Saking dhawuhipun Yudhisthira Abimanyu kêdah anindhihi wadyabala mapagakên pamukipun  Drona, ingkang arakit gêlar cakra byuha.;","Abimanyu, putra Arjuna, perang nglawan Drona kanthi cakra byuha."
" Risaking gêlar wau amung dening Arjuna, Kesawa, Prajumna, , tuwin Abimanyu, sadaya para satriya kêdah wontên ing wingkingipun Abimanyu. Kadospunapa bingahing manahipun Abimanyu sarêng tampi dhawuh makatên wau, sumêngah kadi kang rama, tuwin kadangipun kang ibu. Abimanyu anyanggêmi badhe angrisak mêngsah awit saking asmanipun Sri Krêsna miwah para Pandhawa, lajêng dhawuh dhatêng kusir supados rata kaajêngakên dhatêng barisaning mêngsah. Kadidene sima ingkang nêdhêng tumambirang nêmpuh pabarisan dipangga. Saking bantêring panêmpuh tataning gêlar cakra bibrah, lajêng aprang kalayan Drona, Aswatama, Kripa, Karna tuwin sanès-sanèsipun. Duryudana ugi lajêng atêtulung, Dusasana kataton dening Abimanyu, ngantos kapêksa kasingkirakên saking pabarisan. Kadangipun Karna sirna, Karna piyambak ugi kasêsêr. Jayadrata narendraning băngsa Sindu, sarêng priksa Kurawa karisakan, lajêng atêtulung, ewadene dèrèng wontên ingkang kuwawi mapagakên tandangipun Abimanyu.; ","Abimanyu mimpin perang nglawan Drona, Karna, lan Kurawa, ngalahake Dusasana lan Karna."
"Duryudana nêmpuh malih ugi kapalajêng. Laksmana putranipun Duryudana sirna, nalika nêdya amrawasa prajurit nem-neman, ingkang ajêngipun botên kenging pinambêngan. Abimanyu kinroyok  dening prajurit agêng-agêng nêm: Drona, Aswatama, Kripa, Karna, Kartawarma, tuwin Wrahatbala. Dene Jayadrata mêdhot barisaning wadyanipun Abimanyu, nêmpuh barisaning Yudhisthira. Abimanyu botên gidhuh pinarbutan ing kathah, ngantos Karna tuwin Drona ngangkah anjêmparing langkapipun Abimanyu. Kartawarma amêjahi kapal rakitanipun, Kripa amêjahi kusiripun, dados Abimanyu sampun risak rata tuwin langkapipun, mila lajêng asikêp pêdhang angiwa tamèng. Ananging tamèng saha pêdhangipun ugi lajêng risak, enggal anjêbol rodhaning ratanipun, kaputêr sanginggiling sirah nêdya kapupuhakên Drona. Ing nalika wau rodha ugi lajêng ajur dening jêmparingipun para prawira. Abimanyu musthi gada, ambujêng Aswatama, sarta sagêd amêjahi kapalipun Dusasanaputra, inggih punika wêkas-wêkasaning kasudiranipun Abimanyu. Dusasanaputra tandhing kalihan Abimanyu, lajêng ambruk sarêng. Nanging tanginipun malih rumiyin Dusasanaputra, mila enggal anggada sirahipun Abimanyu, lajêng angoncati.; ",Abimanyu diserang nganti sirna dening prajurit Kurawa.
"Paprangan kèndêl, amargi kasuwuk dening sirnanipun Abimanyu, Yudhisthira sakalangkung rudah ing galih, dene sariranipun ingkang dhawuh mapagakên mêngsah, wêkasan botên sagêd amitulungi prangipun Abimanyu nalika kinroyok dening para têtungguling prajurit. Kadospundi anggènipun sagêd cariyos dhatêng Arjuna, dene anakipun ingkang sangêt dipun trêsnani sampun sirna botên wontên ingkang angrêbat. Maharsi Wiyasa rawuh lajêng angarih-arih dhatêng Yudhisthira ingkang sawêk karêrantan. Sang Wiyasa ngandikakakên sabab-sababipun mila Abimanyu pêjah, sarta para nata ingkang sami sirna dening karsaning dewa, sarta dhawuh manawi para wicaksana tamtu botên amrihatosakên tiyang pêjah. Pangandikanipun: ""yèn wong urip kudu kaanggêp kabungahan, nanging wong mati iku bêgja lan mulya."" Sasampunipun ngandika makatên Sang Wiyasa lajêng musna. Yudhisthira sawatawis lipur, nanging mêksa taksih kraos pakèwêt, panglocitanipun, kadospundi anggènipun badhe ngandika dhatêng Sang Dananjaya.; ","Yudhisthira kuciwa, nanging Sang Wiyasa ngendika mati iku kabungahan."
"Sawangsulipun Arjuna saking paprangan panggalihipun karaos sangêt botên sakeca, mila matur dhatêng Sri Krêsna supados andhawuhakên darunaning raos sêdhih ingkang nangsaya ing manahipun. Ing pakuwon katingal tidhêm, mila saya sangêt sumêlangipun, dados lampahipun karikatakên. Kados punapa kagètipun Arjuna, sarêng aningali kang raka lênggah botên ngandika  sarta Abimanyu botên katingalan wontên ing ngriku. Sami sanalika batosipun Arjuna sampun priksa kadospundi kawontênaning lêlampahan, mila lajêng pitakèn dene Abimanyu botên katingalan: kajaba Abimanyu apa ora ana kang bisa angrusak gêlar cakra, măngka aku ora marah ing dhèwèke, kapriye undure manèh sawuse manêmpuh. Apa wong Pandhawa ngatag Abimanyu anglêboni gêlar? Ananging bapa wau botên pêrlu dipun wangsuli, amung lajêng anangisi pêjahing anakipun, sambatipun: mêsthi Abimanyu nalika kinêmbulan dening Drona, Karna lan Krêpa ora anggagas, apa wong tuwaku ora angêntas aku saka têngahing bêbaya iki. Apa wong Pandhawa utawa wong Pancala ora angayomi bocah cilik iku, apa gêgamane iku mung kanggo pasrèn bae. Wong mau banjur kapriye polahe barêng wêruh Abimanyu mati. Kajawi Krêsna kalayan Yudhisthira botên wontên ingkang purun mangsuli, amargi amung kêkalihipun wau ingkang sabên- sabên tinurut dening Arjuna.; ","Arjuna sêdhih amarga Abimanyu mati tanpa perlindungan, lan nglarani manah, nanging Krêsna lan Yudhisthira ora maringi jawaban."
"Yudhisthira ngandika kadospundi sarêng Abimanyu kadhawahan ngrisak gêlar cakra, kadospundi panêmpuhipun Abimanyu, sarta kadospundi anggènipun sagêd angayomi, nanging kapêksa kanggêg  amargi saking cinêgatan dening Jayadrata. Ing nalika wau Arjuna ambêngok: aku prasêtya, dina sesuk Jayadrata dak patèni, yèn dina sesuk, wanci surup srêngenge durung mati, aku mati lumêbu ing gêni murub. Sarêng Jayadrata mirêng pawartos prasêtyanipun Arjuna makatên wau, saking sangêting ajrihipun, gadhah pangangkah badhe oncat saking pabarisan nêdya sêsingidan, nanging botên saèstu amargi dipun sagahi badhe sami jinagi dening têtindhihing para wira. Drona ngandika minăngka wangsulan dhatêng pitakènipun Jayadrata, ingkang amêksa-mêksa nyuwun kajawab. Sanadyan Jayadrata tuwin Arjuna ugi sami nampèni piwulangipun, ananging Arjuna ngungkuli piyambakipun, amargi Arjuna manggulang panunggal sarta kapêksa nglampahi sangsara, ananging ingsun mêsthi angayomi sira, apadene angaling- alingi sira, nganti Arjuna ora kawawa miyak.; ","Yudhisthira ngêndika babagan Abimanyu, lan Arjuna njanjêni matêni Jayadrata êsuk."
"Ing wêkdal punika Sri Krêsna sangêt anêtah dhatêng Arjuna, dene kasêsa anglairakên prasêtya botên têtarosan rumiyin dhatêng sariranipun. Amargi saking punika para agul-aguling satriya Kurawa nênêm lajêng anjagi Jayadrata kadèkèk ing têngahing pabarisanipun para pinilih, ingkang tamtu botên kenging piniyak. Ananging Sri Krêsna lajêng amêlêng cipta, kadospundi  anggènipun sagêd angêntas Arjuna saking kasangsaran. Sri Krêsna dhawuh supados Arjuna dintên benjing enjing ngangge rata sarta dêdamêlipun Sri Krêsna. Kacariyos Kesawa ngatingali dhatêng Arjuna wontên ing dalêm jaman pasupênan, sawêdalipun saking badanipun wadhag, Arjuna lajêng kaajak dhatêng Kaliyasa, sowan ing Bathara Mahadewa, ingkang cahyanipun sumunar ambalêrêngi. Sri Krêsna kalihan Arjuna lajêng sami mangkurêb ing ngayunanipun. Arjuna pinaringan dêdamêl ingkang angungkuli sadaya dêdamêlipun, kadhawuhan musthi ing dintên enjingipun. Sasampunipun lajêng sami wangsul kalihan suka sokur amargi tamtu badhe manggih unggul.; ",Sri Krêsna mbantu Arjuna nglaksanani prasêtya kanggo mateni Jayadrata kanthi pitulunganing Bathara Mahadewa.
"Enjingipun, dintên paprangan kaping kawanwêlas, Arjuna nilar Yudhisthira, ingkang kapatah rumêksa Sang Sêtyaki, wigatos badhe angupaya Jayadrata, anêtêpi prasêtyanipun. Sakawit kêdah ngrabasèng barisan dipangga, sasampunipun risak lajêng nêmpuh Sang Drona. Sasampunipun sumêmbah ing gurunipun, Arjuna lajêng manrajang amargi Drona pangayomanipun Jayadrata. Sanadyan kadospunapa anggènipun angêtog kaprawiranipun, ewadene Arjuna botên sagêd angundurakên, mila lajêng kapêksa anilar Drona nêmpuh barisan sanèsipun, kaêtut  wuntat dening Krêsna, sarta kaayoman sampun ngantos kaprajaya dening mêngsah. Ing nalika Srutayuda tuwin Sang Amirutayusa anêmpuh Arjuna, suwaunipun Arjuna kasabêt garaning daludag ngantos kalêngêr, nanging lajêng èngêt malih, nêmpuh mêngsahipun ngantos sami lumajêng. Arjuna mandhap saking rata, awit kuda pangiridipun kataton, lajêng ngamuk dharat. Dene Kesawa angguyang kuda ingkang kataton wau, kadi botên wontên ing antawising mêngsahipun. Dupi kapalipun sampun waluya, Arjuna numpak rata malih angrabasèng mêngsahipun, nadyan Duryudana ingkang angrêgêm dêdamêl sarwi matêk măntra warahipun Drona, kalampahan datan busik kataman saliring dêdamêl, ewadene kapêksa oncat. Salêbêtipun Arjuna riwut pangamukipun, Drona amikud Yudhisthira, kabêkta lumajêng. Kang sudira Sang Satyaki wêkdal punika anglampahi dhawuhipun Yudhisthira supados amêmanuki prangipun Arjuna, sarêng priksa Yudhisthira tinawan dening Drona lajêng anututi. Pangangkahipun kasêmbadan, amargi sagêd angrisak barisanipun Drona, sarta amêjahi kusiripun, mila kapal pangiriting rata ambandhang sakajêng-kajêngipun piyambak, punapadene Bima katingal kêkêndêlanipun ngantos adamêl mirising akathah.;  ","Arjuna nglawan barisan Drona kanggo ngukum Jayadrata, ngetutake dhawuhe Sri Krêsna lan Yudhisthira."
"Drona ratanipun ginada rêmuk, nanging Drona mancolot saking rata, punapadene Karna sami kapêksa angunduri. Sawangsulipun Drona tuwin Karna lajêng wiwit gêgêmpuran malih, nalika wau Karna kacêpêng dening Bima, nanging Bima èngêt pangancamipun Arjuna dhatêng Karna, mila lajêng kauculakên. Kawuningana sarêng Bima gêntos kacêpêng dening Karna, ugi lajêng botên pinarwasa awit Karna èngêt dhatêng prasêtyanipun nalika wontên ngarsanipun Dèwi Kunthi, nanging surya sampun ngajêngakên sêrap, măngka sêsanggêmanipun Arjuna dèrèng kalaksanan, amargi Jayadrata tansah kajagi rêmpit dening ingkang sami sagah angayomi. Saking pangwasaning yoga Kesawa anasapi surya, mila lajêng pêtêng kados sampun sêrap. Jayadrata ingkang rumaos sampun wilujêng mêdal saking pabarisanipun ingkang rumêksa. Arjuna anêmpuh tandanging satriya nênêm ingkang anjagi têmah sami lumajêng, ing ngriku Arjuna mêndhêt sanjata pamungkas, minantran, lajêng kalêpasakên dhatêng Jayadrata, amargi Kesawa pêpèngêt, manawi saking sabdaning bapakipun: sintêna ingkang amêjahi Jayadrata, mugi-mugi sirahipun Jayadrata pêcaha dados sèwu. ;","Arjuna, dibantu Sri Krêsna, ngalahake Jayadrata sanalika sawisé nglawan Drona lan Karna."
"Inggih asarana jêmparing punika Arjuna anggènipun anugêl guluning mêngsahipun,  sarta sinarêngan jêmparing sanèsipun, ngantos sirahipun Jayadrata dhawah ing pangkoning tiyang sêpuhipun, ingkang lajêng mancolot saking kagèt aningali sirahing anakipun dhawah, sarta kalajêng pêjah amargi saking sotipun piyambak. Makatên wau lêlampahan pêjahipun Jayadrata, dados prasêtyanipun Arjuna sampun kalêksanan. Surya katingalan malih, Arjuna lajêng ambujêng Krêpa tuwin Aswatama ngantos mêdal saking pabarisan. Satyaki sagêd ambuncang Karna malih saking ratanipun. Sanadyan lajêng katungka sêraping surya, ewadene paprangan botên lajêng kèndêl, kalajêngakên prang dalu, sarta botên sami mundur dening pêtênging wanci dalu. Paprangan agêng ing dalu wau ingkang anggêgirisi piyambak, prangipun Gathutkaca kalihan Karna. Campuhipun sakalangkung rame, wusana Karna kapèpètakên dening Gathutkaca, ngantos Karna bingung dening pujan kawujudanipun Gathutkaca, mila Karna angunus sanjata Kunta pêparingipun Hyang Indra, sarta anting-antingipun pisan  Lajêng kalêpasakên, ing ngriku botên wontên kawasa ingkang sagêd adamêl cabar. Jêmparing lumêpas angênani Gathutkaca dhawah Kurawa surak mawurahan. Sarêng Pandhawa priksa bilih Gathutkaca pêjah sami anangis, amung Kesawa surak amratandhani bingahing panggalih.; ","Arjuna ngalahake Jayadrata, lan Gathutkaca ngalahake Karna."
"Saking sangêt kagawokan mila Arjuna matur pitakèn dene wontên lêlampahan kang mokal. Kesawa pratela manawi salêbêtipun Karna taksih kanggenan jêmparingipun Hyang Indra, sagêd anyirnakakên mêngsahipun satunggal, pundi ingkang kinajêngakên, măngka samangke sampun kalêpasakên, dados Arjuna mêsthi wilujêng, sarta sagêd anyirnakakên Karna. Sampun mêsthi jêmparing wau tansah kapundhi-pundhi dening Karna, prêlu badhe kangge mrawasa mêngsahipun ingkang tansah kaajap-ajap, malah badhe kasarêng kalayan Kesawa, ananging kasupèn ing wanci anggènipun badhe anglêpasakên. Samangke pangwasanipun sampun têlas, pangajêng-ajêng dhatêng lêstantunipun gêsang sampun sirna amargi saking pandamêlipun piyambak. Dumugi wanci têngah dalu, para prajurit ingkang sampun sangêt sayahipun sami tilêm kalayan băndayuda, mila Arjuna lajêng undhang angèndêlakên prangipun, ngantos rêmbulan dadari.; ",Arjuna bisa ngalahake Karna lan prajurit padha kesel ngaso nganti têngah dalu.
"Paprangan wiwit malih, ramening ingkang sami băndayuda tansah matambah- tambah, dene ingkang minăngka watêsing dintên paprangan kaping gangsal wêlas, punika campuhipun Arjuna kalihan Drona, kalihipun sami angêdalakên pangabaran warni-warni, botên wontên ingkang kasoran, lajêng sami anêmpuh sanès barisan, nanging taksih sami prang, wasana Kesawa paring dhawuh wontêna ingkang suka pawartos dhatêng Drona, manawi Aswatama kasambut ing adilaga. Arjuna botên kadugi anglampahi, nanging Bima sigra amêjahi gajah ingkang nama Aswatama, sarwi manguwuh sora: Aswatama mati. Lêrês Aswatama pêjah nanging Aswatama gajah, sanès Aswatama putranipun Drona. Sakawit Drona sêdhih, nanging lajêng sirna, amargi andugi bilih pawartos punika cidra. Ing nalika wau para maharêsi sami manguwuh dhatêng Sang Drona bilih sampun dumugi mangsanipun Sang Drona anilar marcapada. Sami sanalika, kapapagakên dening Drêstajumna ingkang pinasthi anguntapakên angkatipun Drona dhatêng kaswargan. Drona lajêng larut bingah ing manahipun, enggal pitakèn dhatêng Yudhisthira, ingkang sampun prasêtya bilih botên badhe cidra, sanadyan ginanjar mangrèh tri bawana. Lêrês punapa botên pawartos pêjahipun Aswatama wau. Saking wêwêlingipun Sri Krêsna kêdah cidra, makatên cobi tumrap sihipun Yudhisthira dhatêng katêmênan. Ing têlênging batosipun Yudhisthira isi watak kirang santosa, sarta kasangêtên rêmênipun miturut dhatêng tiyang sanès, mila botên kawawa madêg saha adamêl kêkêncêngan piyambak. Ambêgipun alus, adil, momot tuwin sih, nanging ing nglêbêtipun isi watak kirang kêkêncêngan, mila tamtu wontên gampil sangêt dipun ewahi ing liyan.  măngsakalanipun kalair, anjalari kuciwanipun, dados; ","Drona kaget amarga kabar palsu Aswatama mati, banjur sedhih ngerti kasunyatan."
" Yudhisthira wicantên sora: Aswatama pêjah, lajêng wicantên lirih: Aswatama gajah, ingkang makatên têmên ing lair, nanging batosipun cidra, kajêngipun murih sampun ngantos cidra lair batosipun. Wiwit purun cidra, rata sarakitanipun ingkang salami-laminipun botên anapak siti, punika lajêng sumèlèh ing siti kados limrahing akathah, ingkang makatên pratandhaning kuciwanipun. Sarta margi saking wigaring subrata, saha prihatosipun sadanguning gêsang,  adamêl sirnaning watakipun Yudhisthira ingkang tanpa kêkêncêngan wau. Kayêktèn nalika Yudhisthira badhe murut dhatêng kahanan jati, wontên cobaning dewa malih, inggih punika Yudhisthira kadhawuhan anilar sêgawonipun ingkang sangêt sêtya, Yudhisthira kawawa nampèni coba, puguh botên purun nilar, Yudhisthira manjing ing kaswargan, lêstantun wontên ing ngriku ngantos dumugi satêlasing wêwangên. Manawi dewa anggodha manungsa ngantosa pêntoging kasantosanipun, punika amung murih supados piawoning manungsa sanadyan sapintên alitipun sagêda kawêdal, dados lajêng sukci botên kawoworan piawon, wasana tiyang lajêng pitados dhatêng pribadinipun, manawi kataman kasusahan tuwin cobi.;","Yudhisthira ngendika ""Aswatama pêjah,"" nanging sawise, ngendika ""Aswatama gajah"" amarga atiné kuciwa."
"Rikala Drona midhangêt ucapipun Wrêkudara, măngka Yudhisthira ugi amastani bilih putranipun sirna, enggal ambucal gandhewanipun, lajêng asêmadi wontên sanginggiling rata. Ing nalika punika Drêstajumna malumpat saking rata anarik pêdhang, marêpêki senapati ingkang sampun ambucal dêdamêlipun, sarta lajêng tinigas utamangganipun. Oncatipun saking sarira wadhag, suksmanipun Drona katingal sumorot anêlahi, wêkdal samantên ing gêgana kadi wontên surya kêmbar. Sarêng sampun kaoncatan, kunarpanipun dhawah saking rata, patrap panigasipun Drêstajumna dhatêng jangganipun senapati agêng ingkang yuswanipun sampun wolungdasa gangsal taun punika, rikmanipun ingkang pêthak kaukêl ing asta kiwa, lajêng sirah kapisah saking sariranipun, sirahing guru ingkang para siswanipun sami dados têtindhihing prang agêng punika. Arjuna amambêngi: guru iku pasrahna urip, aja kasirnakake, panjênêngane aja kongsi tumêkèng lena. Nanging botên kapaèlu dening Drêstajumna, sang maharêsi sampun oncat saking papa sangsara, ingkang sinangkulakên, lajêng ambangun kamulyan ing alaming brahma, , ing ngriku sampun botên katêmpuh kasangsaran ing dunya. ;","Drêstajumna ngancurake Drona kanthi motong sirah, sanadyan Arjuna nyuwun supaya gurué ora dipatèni."
"Sasirnanipun Drona, wadya Kurawa mawut asarsaran, Aswatama mirêng bilih kang rama kaparèng tiwas, miwah siya-siya patraping mêngsahipun, dene rikmanipun mawi kajambak. Prasêtya bilih badhe amalês dhatêng Drêstajumna, pramila lajêng angèsthi jêmparingipun Wisnu, ingkang kenging kangge ambêsmi mêngsahipun. Aswatama anarubakên sakathahing wadyabala ingkang sami lumajêng, lajêng tinindhihan. Ing wêkdal punika ugi Arjuna manangis kalihan sangêt trênyuhing panggalih angèngêti sirnaning gurunipun, sarta piduwung dhatêng kalintuning patrapipun. Sanadyan sariranipun ugi sampun angemutakên, ewadene kalampahan sirna, saha sangêt kacêcamah wontên ing ngajêngipun, ucapipun: dhuh guru: kula silêm ing dalêm naraka, sarta pêjah kanthi nandhang kalingsêman. Bima tuwin Drêstajumna sami ngoso dhatêng Arjuna, nanging Satyaki anglêrêsakên, malah angawon-awon dhatêng Drêstajumna, sami gêgrêjêgan, nanging lajêng katungka panêmpuhipun wadya Kurawa, kadi anyapih ingkang sami nêpsu. Aswatama krodha angayat jêmparing latu mêdal angalad-alad, ambrastha barisan Pandhawa, Sang Kesawa enggal undhang dhatêng wadya Pandhawa, sami sèlèha dêdamêl, lajêng asidhakêp, awit amung sarana patrap makatên katulakipun jêmparinging dewa,  amung Bima botên miturut pitêdahipun Krêsna, lêstantun anggèning nêdya mapagakên tandangipun Aswatama, mila anggung kabêbujêng ing latu.;","Aswatama nglawan kanggo ngukum Drêstajumna, nanging Arjuna nangis amarga sedhih gurué wus tiwas."
" Bima lajêng kasêndhal mandhap dening Arjuna miwah Kesawa, dupi sampun botên wontên ingkang wahana rata miwah sikêp dêdamêl, jêmparing latu sirna sami sanalika. Duryudana mangatak mring Sang Aswatama, anglêpasna jêmparing malih, nanging Dronaputra nêmbah sarwi prihatos, matur manawi jêmparingipun sampun botên sagêd wangsul malih, dados sampun botên sagêd amrajaya mêngsahipun. Kesawa manggih unggul. Têtela Kesawa botên sagêd sirna dening mêngsah. Kacariyos wiwit prang malih, kusiripun Bima pêjah kataman jêmparing, kuda ambandhang ambêkta Sang Bima, Arjuna nêmpuh Aswatama, angudani jêmparinging dewa dhatêng Aswatama, têmahan Aswatama kuthetheran lajêng anguncati. Ing wanci dalu Arjuna anggènipun ngrabasèng mêngsahipun pintên-pintên aksuini. Palajêngipun Aswatama kalayan sangêt anggarantês dene botên sagêd adamêl sirnanipun Arjuna tuwin Kesawa wontên ing madyaning paprangan. Aswatama sowan dhatêng Sang Bisma nyuwun pitêdah dene Arjuna tuwin Krêsna botên sirna dening jêmparingipun.;","Bima, Arjuna, lan Kesawa padha ngadhepi Aswatama ing perang, nanging Aswatama ora bisa dikalahake."
" Kaparingan priksa sintên sajatosipun Arjuna tuwin Kesawa, mila botên  sagêd sirna dening bramastra, , ing ngriku Aswatama lajêng undhang supados kèndêl anggènipun prang, amargi sampun sêrap surya. Dupi ingkang prang sampun sami kèndêl, Arjuna marêk ing ngarsanipun Wiyasa, mitêrangakên sintên kawontênanipun ingkang anggung wontên sangajênging ratanipun, sarta tansah amarjaya mêngsah, nanging katingalipun kados Arjuna piyambak. Sang Wiyasa ngandika manawi punika Bathara Mahadewa, ratuning para dewa. Sang Wiyasa nyariyosakên kaluhuranipun Bathara Mahadewa. Inggih ing ngriku wasananing Dronaparwa.; ","Arjuna lan Kesawa ora bisa dikalahake bramastra, amarga iku Bathara Mahadewa."
"Dintên paprangan kaping nêmbêlas, winastan Karnaparwa. Karna kajumênêngakên senapati. Ramening paprangan botên suda malah andados, Karna ajêng-ajêngan prang kalayan Nangkula, ngantos kusiripun, kapalipun tuwin dêdamêlipun Nangkula sami sirna. Ananging Nangkula botên pinêjahan, angèngêti kasagahanipun dhatêng Dèwi Kunthi. Nangkula kinalungan kêndhênging gandhewa lajêng kauculakên. Yudhisthira ugi botên karsa amêjahi Duryudana ingkang nandhang kanin ngantos kantu, dening dêdamêlipun, mila botên linampus amung angèngêti dhatêng pangancam-ancamipun Bima. Kanugrahan ing dintên punika kakêkap dening Arjuna, amargi Arjuna sagêd ambibarakên mêngsahipun, sapêngkêring mêngsah;","Ing paprangan kaping wolu, Karna nglawan Nangkula lan Yudhisthira, nanging Arjuna bisa ngalahake."
